,Rating,Comments,overall,negative,neutral,positive,compound
137,★★★★½,"Have not seen this since it was originally in the theaters and I like it now even more. Best part about it is how Pacino & William's characters keep one-upping each other trying to get dominant control of the situation. The acting, cinematography, and score are superb.",4,0.0,0.791,0.209,0.902
138,★★★★,Amazing. I'm glad the real account of catching Alaskan murderer Dimitri Keogh has finally been documented on film.,4,0.174,0.568,0.258,0.296
139,★★★½,(I know Jonathan Nolan is from Chicago. The joke works better if he has a British accent. Fuck you.),3,0.148,0.636,0.216,0.1531
140,★★★★★,"Believe it or not, people refer to this as Nolan's worst film. That's honestly horseshit. If you haven't seen this because of those rumors, or for any reason, do yourself a favor and watch this underrated masterpiece.",5,0.089,0.697,0.214,0.6908
141,★★★,6.3/10,3,0.0,1.0,0.0,0.0
142,★★★½,"I avoided this one for a long time because I thought it was an adaptation to the Stephen King novel of the same title. (Wasn't a fan of that book, if you couldn't guess.) This was actually very enjoyable. Robin Williams knocks his role out of the park, and Pacino isn't bad either. I wish Williams and Pacino had been on screen together more, though.",3,0.096,0.783,0.121,0.4065
143,★★★★,"when someone knows everything about the other, is it a must to say ""ugh, you did your homework""?",4,0.0,1.0,0.0,0.0
144,★★★★½,Eye bags on fleek,4,0.0,1.0,0.0,0.0
145,★★★★,Al Pacino has one of the best sleepy expressions ever in this.,4,0.0,0.724,0.276,0.6369
146,★★★½,Christopher Nolan Films Ranked,3,0.0,1.0,0.0,0.0
147,★★★★,#RW,4,0.0,1.0,0.0,0.0
148,★★★★½,"It looks stunning and the story is excellent, I really enjoyed this.",4,0.0,0.447,0.553,0.8718
149,★★★½,"Good but not my favourite Nolan by a long shot. I think you could have even justified another 10-15 to give Swank a bit more of a role than she had but Pacino and Williams have good chemistry, surprising not so cerebral from Nolan (well nothing is compared to memento really) but still an interesting piece.",3,0.0,0.751,0.249,0.9387
150,★★★,"This doesn't feel like any other Nolan movie. It's hard to tell if he had the choice of the cast, score, or source material. Al Pacino does play wonked out insomniac well, even if the character of ""Al Pacino, actor"" hangs too heavy on the movie. The story plays out well enough, but it doesn't cut like every other Nolan movie does. This feels like a Kubrick to Spartacus movie, a studio project where the director is an afterthought to the point their voice is taken out of the movie. That might not have been the case, I don't know, but that's how it certainly seems.",3,0.072,0.825,0.103,0.3687
151,★★★½,fatpie42.livejournal.com/266588.html,3,0.0,1.0,0.0,0.0
152,★★★★,"The story was different enough to be interesting but nothing super original or exciting. Still, it wasn't boring and it is worth a watch, especially if you want to see Williams in an unusual role.",4,0.143,0.581,0.275,0.6281
153,★★★,"was enjoyable enough, however I was expecting more from this particular director who a vast majority of people adore so much. I thought the plot could have been stronger, it wasn't particularly suspenseful at any point and perhaps the screenplay was a little lazy. Liked the performances, but quite possibly a film I'll forget about by tomorrow.",3,0.068,0.796,0.135,0.4324
154,★★★½,"Not Nolan's best but still a good not great psychological drama. Al Pacino gives a great performance as the L.A.P.D legendary cop with mental issues of guilt with Insomnia. Hilary Swank is great as the rookie Alaska detective. Robin Williams who doesn't appear on-screen until an hour into the film, he's excellent. Insomnia starts off very slow first 30 minutes which is the reason why I didn't give this a higher rating but once it's settles in the last hour & 20 minutes of the film, it's good.",3,0.171,0.708,0.12,-0.6605
155,★★★★,"Holy, Robin Williams had range! What a sad loss.",4,0.487,0.513,0.0,-0.69
156,★★★½,Al Pacino really sucks at frogger,3,0.358,0.642,0.0,-0.4201
157,★★★½,The level of exhaustion Al Pacino wears on his face here....honestly goals,3,0.185,0.815,0.0,-0.3612
158,★★★★★,No one is innocent,5,0.333,0.303,0.364,0.0516
159,★★★★,Director Christopher Nolan's post-Memento paycheck gig - and least distinctive film - outshines the Norweigan original thanks to taut writing by Hillary Seitz and underrated performances from Al Pacino and Robin Williams.,4,0.0,0.843,0.157,0.6369
160,★★★★,solid. good one chris.,4,0.0,0.308,0.692,0.5423
161,★★★½,he has become that fucking owl.,3,0.0,1.0,0.0,0.0
162,★★★,"not my favorite thing Christopher Nolan has ever done but it makes for an entertaining mystery thriller, especially because of Al Pacino and Robin Williams.",3,0.06,0.754,0.187,0.5733
163,★★★★,P.S.- Al Pacino should have had dark circles around his eyes by the end of the movie. Just saying.,4,0.0,1.0,0.0,0.0
164,★★★½,it is absolutely bonkers to watch someone as beloved as robin williams play a role that was clearly written for kevin spacey,3,0.0,0.682,0.318,0.8126
165,★★★★,Good movie severely underrated tbh. Love Pacino and Williams dynamic is good and the premise has a unique spin it was good but not perfect. Pacing was the main issue,4,0.157,0.575,0.268,0.3078
166,★★½,"Insomnia has some great scenery and performances but man I couldn't get into this as much as I wanted to. The script just felt painfully generic and Nolan's direction was just kinda there I guess? I haven't seen the original film this is based on but this definitely screamed ""weaker american adaptation"" to me.",2,0.214,0.681,0.104,-0.7967
167,★★★½,"A better-than-average psychological thriller, and perhaps Nolan's most straightforward film in terms of narrative structure and chronology. Alaska-as-Purgatory works really well, with the eerie fog, dark waters, and unyielding midnight sun. A tale of a guilty L.A. cop having his hidden sins exposed has a particular resonance in our present times. The light shines in the darkness, and the darkness has not overcome it.",3,0.196,0.749,0.055,-0.8319
168,★★★,robin williams and al pacino were robins williams and al pacino. this was underwhelming,3,0.0,1.0,0.0,0.0
169,★★★½,"The last movie I needed to watch to complete my Nolan rank. Oh my god I was not expecting Robin Williams to be that convincing as a bad dude. His lack of screen time, mannerisms, and the way he talked, I was just like damn! I am scared of this guy. The least 'Nolan' of his movies I think. But that can sometimes be a compliment. He is so hit and miss for me, moreso than probably any other director. But this a good one tho.",3,0.139,0.713,0.148,0.2031
170,★★★★,"It shows that the border between good and bad is more complicated that it sounds . It's psychological , intense and dark . Al Pacino and Robin Williams had fantastic performances .",4,0.099,0.68,0.221,0.5106
171,★★★,I wish Robin Williams had played more psychos.,3,0.0,0.495,0.505,0.6249
172,★★★½,"is a very polished and intriguing thriller filled with twists, with great seasoned actors as protagonists, featuring beautiful tense cinematography and successfully utilizing the setting of Alaska effectively.",3,0.062,0.54,0.398,0.9201
173,★★★½,Great acting - decent plot - odd editing choices at times.,3,0.172,0.522,0.306,0.4215
174,★★★★,"solid script, but a masterclass in editing.",4,0.0,0.794,0.206,0.0772
175,★★★,", but still manages to be a mostly engaging crime thriller that features solid performances from Pacino and Williams.",3,0.195,0.534,0.271,-0.0387
176,★★★½,"I forgot this was directed by Christopher Nolan, it just felt like a mix of The Snowman and Hangman.",3,0.0,0.865,0.135,0.3612
177,★★★★½,A showcase of the insane talent of Robin Williams and Al Pacino in a near-perfect thriller with a somewhat predictable and conventional final act.,4,0.108,0.723,0.169,0.128
178,★★★★,Probably Nolan's least ambitious out of his filmography. But still Insomnia is an effective enough psychological thriller that's well-shot and features stellar performances from Al Pacino and Robin Williams.,4,0.077,0.787,0.136,0.2373
179,★★★½,Nolans least rewatchable film... And probably his worst. It's still pretty good. Probably a 4 star movie but watching it again adds nothing so just don't rewatch it.,3,0.086,0.777,0.137,0.128
180,★★★★,not much of a visual sense though,4,0.0,1.0,0.0,0.0
181,★★★★,it didn't feel like a nolan film but i still really enjoyed it,4,0.101,0.583,0.317,0.6525
182,★★★★,"While it may not be the deepest or most thought provoking psychological thriller, ""Insomnia"" ultimately works as well as it does due to the terrific performances of the cast. Al Pacino and Hilary Swank are terrific as usual but it's Robin Williams who steals the show as the menacing and creepy antagonist. Christopher Nolan direction is strong and has certain sequences that will surely have you gripping the edge of your seat. A rather underrated crime thriller.",4,0.149,0.653,0.198,0.2049
183,★★★½,"Coyly subverts cop-drama expectations and turns the typical cat-and-mouse game on its head, although the final act still needlessly succumbs to unwanted action tropes.",3,0.076,0.924,0.0,-0.2263
184,★★★½,"Though Nolan's mystery drama is a well-crafted work of film driven by an outstanding Al Pacino, the story is far too straightforward for both my taste in murder mysteries and my expectations of Christopher Nolan. Nonetheless, I will not attempt to deny what this film does get right, which is a few solid performances, an interesting story that is capable of making you feel as though you have secrets to hide, and solid direction as always from one of the best directors around. It's an entertaining and well-written drama, but if you're a fan of Nolan's mind-blowing twists, you won't be quite as satisfied.",3,0.037,0.771,0.192,0.9285
185,★★★★½,Who has Two Thumbs and Loves Blowjobs?,4,0.0,0.619,0.381,0.5719
186,★★½,"Christopher Nolan is the consummate plain yogurt director. ""Insomnia"" is a pulpy haze of webbed shadows, but the safety net is always present. Al Pacino is the gruff, dogged cop with weathered eyes and a dodgy temperament. Physically, he is present, but otherwise the actor looks to be spiritually someplace else. And nothing is more upsetting than Hilary Swank playing a version of Amanda Peet.",2,0.034,0.83,0.137,0.8023
187,★★★★,Now just let me get some sleep..,4,0.0,1.0,0.0,0.0
188,★★★½,Gunda,3,0.0,1.0,0.0,0.0
189,★★★½,Christopher Nolan Ranked,3,0.0,1.0,0.0,0.0
190,★★★½,"Definitely worth the watch for Robin William's performance. It is not bad for one of Nolan's early works, but I don't see myself rewatching it.",3,0.0,0.801,0.199,0.4981
191,★★★★½,Nolan is a genius,4,0.0,1.0,0.0,0.0
192,★★½,This is just an another average thriller but watchable for the subtle performances of Al Pacino and Robin Williams.,2,0.0,0.938,0.062,0.0516
193,★★★★,Gosh Williams is outstanding in this film. I judged Pacino for too long he is always so good,4,0.0,0.66,0.34,0.829
194,★★★½,dunkaccino!,3,0.0,1.0,0.0,0.0
195,★★,"Like he strikes me as someone that wouldn't laugh if he saw someone fall on ice but if there was a killer pun about cinema with a great punchline, he would do a light chuckle then find himself one day remembering it while brushing his teeth in front of the mirror",2,0.154,0.671,0.175,0.3156
196,★★★★,"Robin Williams could've killed a dozen people right in front of me and still convinced me it didn't happen with the power of his kind, soothing voice.",4,0.129,0.63,0.241,0.4404
197,★★★½,When they're running across those logs it's like Frogger and Robin Williams is a GAMER.,3,0.0,0.839,0.161,0.3612
198,★★★,For as original and mind-bending a lot of Christopher Nolan's movies are...this surely feels a lot like Se7en (by David Fincher)? Does anyone else agree with me in that this just feels so similar to that?,3,0.0,0.74,0.26,0.8611
199,★★½,so boring bruh oh my god come on chris wtaf bro,2,0.189,0.657,0.153,-0.1263
200,★★★½,"Solid crime thriller, doesn't reinvent the wheel but is held together by strong performances from Al Pacino and Robin Williams. Could tell Nolan didn't write this, but that's not necessarily bad",3,0.058,0.667,0.275,0.8164
201,★★★★,Also quite the irony of watching this when TENET got delayed again lol.,4,0.209,0.618,0.173,0.1082
202,★★★★½,UNDERRATED,4,0.0,1.0,0.0,0.0
203,★★★★,"TENET hype got me to finally watch this early Christopher Nolan film, and man I have no idea why I waited this long to watch this film! Pacino and Williams' dialogues were perfectly written and this script was way more than a standard cop mystery. Still, somehow thinking of more recent Nolan films I thought of a twist that was going to happen but then it didn't, but when the credits rolled I was nevertheless wholly impressed.",4,0.02,0.849,0.13,0.8655
204,★★★½,"Not Nolan's best movie but still great with good story, unique setting and solid performances by all the cast.",3,0.076,0.525,0.399,0.8811
205,★★,please why is this so boring..........,2,0.0,0.685,0.315,0.3182
206,★★★★½,"I'm not ready to give this 5 stars but that doesn't change the fact that this movie is fantastic! It's comlex, it's layered and it's very well written. Great performances and of course the directing from Nolan is incredible. This just further proves my opinion that he is the best director of all time.",4,0.022,0.689,0.289,0.9704
207,★★★★,"P.S. Now with this and the short ""Doodlbug"" I've now seen all of Christopher Nolan's films to date.",4,0.0,1.0,0.0,0.0
208,★★★½,7/10,3,0.0,1.0,0.0,0.0
209,★★★½,"Yeah, that ending sequence sure is worse than the rest of the film. Though the rest is really good, so it don't necessarily have to say so much about the ending. But it kind of does anyway.",3,0.071,0.754,0.176,0.5563
210,★★★★,R.I.P Robin Williams. HUGE loss,4,0.276,0.36,0.364,0.186
211,★★★★½,#Insomnia,4,0.0,1.0,0.0,0.0
212,★★★½,"One of Nolan's stronger films, IMO. He doesn't try to do too much and creates a beautiful recreation of a story with a parallelism between guilt and insomnia...hehe",3,0.066,0.662,0.271,0.7579
213,★★★½,Solid movie with an incredible performance from both Al Pacino and robin Williams.,3,0.0,0.882,0.118,0.1531
214,★★★,"Kind of underwhelming considering the cast and crew. The fact that Nolan made this between Memento and Batman Begins, a completely unique take on the psychological thriller and then a completely unique take on a superhero movie, makes Insomnia even less impressive. Insomnia is a good thriller, but I just don't think it's as great as one would expect.",3,0.0,0.803,0.197,0.8751
215,★★★,Solid Nolan film.,3,0.0,0.556,0.444,0.1531
216,★★★,A murder mystery that has zero mystery and tension. The sleepy small town atmosphere is nice and makes it feel a bit different from the other Nolan movies.,3,0.213,0.701,0.085,-0.6369
217,★★★½,B+,3,0.0,1.0,0.0,0.0
218,★★★½,"A super underrated film. Tough to compete with most of Mr Nolan's ouevre but it isn't his worst film as some would have you believe. There's plenty to like about it. This review really seems to be damning with faint praise but I think it's a very solid thriller with excellent performances and an intriguing premise. I'll get around to the original eventually, I'm sure.",3,0.051,0.595,0.354,0.9798
219,★★★½,Decent 7,3,0.0,1.0,0.0,0.0
220,★★★½,"A different outing from Christopher Nolan, abs a very effective remake. The ensemble cast is terrific but obviously Al Pacino and Robin Williams are the standouts. Delivering tense and layered performances that elevate the already strong script. Couple that with the unique location of Alaska during its endless summer Period and you have a recipe for success.",3,0.047,0.744,0.209,0.8921
221,★★★★½,What a great performance by both Al Pacino and Robin Williams. And of course the most underrated movie by Christopher Nolan.,4,0.0,0.823,0.177,0.6249
222,★★★½,"Insomnia isn't anything particularly novel or special, but Nolan uses the sleeplessness of Pacino's character to his advantage, creating a gradual loss of control as the film progresses, and using light to create suspense, instead of darkness, which is always very cool.",3,0.187,0.574,0.239,0.437
223,★★★★,"Alaska looks beautiful, what a great setting for any movie. You get Williams, Pacino, and Swank. Oh and Pacino is slowly losing his mind, great performance.",4,0.073,0.588,0.339,0.8885
224,★★★★★,"Like Seven, but under a microscope, and ten floodlights for good measure. Beautiful, lite-brite neo noir. And some damn fine acting to boot.",5,0.105,0.504,0.39,0.8625
225,★★½,this film gave me insomnia due to how boring it was,2,0.187,0.813,0.0,-0.3182
226,★★★½,he's so sleepy!,3,0.0,1.0,0.0,0.0
227,★★★½,boxd.it/5hKTQ,3,0.0,1.0,0.0,0.0
228,★★½,"So desperately wants to be a Fincher movie, but fails in just about every department",2,0.32,0.68,0.0,-0.6855
229,★★½,i love you chris nolan but what was this,2,0.0,0.729,0.271,0.3818
230,★★★★,Insomnia and Memento >>>> Inception and Tenet,4,0.0,1.0,0.0,0.0
231,★★★,"(2008), with Christian Bale and Heath Ledger dueling each other.",3,0.0,1.0,0.0,0.0
232,★★★★,Loved it once again.,4,0.0,0.435,0.565,0.5994
233,★★★,Christine Nolan Ranked,3,0.0,1.0,0.0,0.0
234,★★★½,Low key totally bonkers Pacino performance.,3,0.296,0.704,0.0,-0.2732
235,★★★½,"This is still just a solid watch. There's good ""unleashed detective"" stuff. The Pacino-Williams scenes don't disappoint. The chase scenes stand out. I think what impresses me the most is that the Robin Williams character is 2 steps ahead and 80000 IQ smarter. Really interesting stuff.",3,0.0,0.7,0.3,0.9307
236,★★★½,Well... watching Good Will Hunting will never be the same,3,0.0,0.756,0.244,0.4404
237,★★★★,"when that 18 year old hit on 62 year old al pacino,,,yeah",4,0.0,1.0,0.0,0.0
238,★★★½,7/10,3,0.0,1.0,0.0,0.0
239,★★★½,"A well made thriller with great execution and direction (of course), filled with some excellent performances.",3,0.0,0.493,0.507,0.8834
240,★★★½,of them all,3,0.0,1.0,0.0,0.0
241,★★★,"Al Pacino throwing a curve ball in this movie. Instead of giving us his usual crazy eyes, he gives us drowsy eyes.",3,0.101,0.798,0.101,0.0
242,★★★½,Robin Williams playing the creepy bad guy is such a rare occurrence but he does such a good job,3,0.105,0.651,0.244,0.4588
243,★★★★½,Underrated Nolan film. Man was just tryna sleep,4,0.0,1.0,0.0,0.0
244,★★★½,"Far from Nolan's best, but still a good film in it's own right. Al Pacino and Robin Williams deliver some damn solid performances and are backed by some decent writing and an intriguing plot. I can't help but feel like parts and elements of this have been done better by other films, but this is not by any means a bad movie. It's not an essential Nolan film, but I enjoyed it.",3,0.124,0.643,0.233,0.8344
245,★★★,"It's a regular cop-chases-a-killer story. As cliched as it sounds, I'll say it anyway, this, undoubtedly is Nolan's anomaly, probably the worst per his standards, yet notches above the mediocre noir films.",3,0.12,0.88,0.0,-0.6249
246,★★★★½,and sets Nolan on a journey to be a phenomenal filmmaker.,4,0.0,1.0,0.0,0.0
247,★★★,"Everything about Robin Williams' character elevates this film, but unfortunately be doesn't really come in until at least an hour into the film. As far as English-language remakes go, it's not terrible.",3,0.085,0.823,0.091,0.0595
248,★★,I was waiting for Al Pacino to whisper ''Insomnia'' at the end of the movie.,2,0.0,1.0,0.0,0.0
249,★★★★,Christopher Nolan Ranked,4,0.0,1.0,0.0,0.0
250,★★★★,"Intense script, enjoyable watch, cat and mouse chasing the killier of a girl in some very pretty Alaskan location. Who will survive? Could watch again.",4,0.0,0.732,0.268,0.7713
251,★★★½,"Also, what happened to Maura Tierney, and why isn't she in everything?",3,0.0,1.0,0.0,0.0
252,★★★½,Al Pacino in this movie is like me when I take Ambien before work.,3,0.0,0.828,0.172,0.3612
253,★★★★,One of Pacino's most memorable latter day performances. Shows that when he works with a top director that he can still be near to the top of his game.,4,0.0,0.878,0.122,0.3818
254,★★★★,". Truly, the most standout aspect of this project is Robin Williams' performance as the serial killer, churning out a chillingly disturbing performance that overshadows Al Pacino tenfold.",4,0.227,0.687,0.087,-0.6908
255,★★★½,"Polished, adult commercial filmmaking, much more than the straightforward procedural I was expecting.",3,0.0,1.0,0.0,0.0
256,★★★,Robin Williams is the Gollum to Al Pacino's Smeagol. I'm only kind of joking.,3,0.0,0.89,0.11,0.1548
257,★★,"This didn't feel like a Nolan movie. It wasn't necessarily bad, but it wasn't really good either in my opinion.",2,0.218,0.698,0.084,-0.4703
258,★★★★,"This gets better every time I see it, only Christopher Nolan could pull a performance this good out of an aging Al Pacino while Robin Williams is excellent.",4,0.0,0.697,0.303,0.8743
259,★★★★½,Pacino and Williams (RIP) are what acting is all about.,4,0.0,1.0,0.0,0.0
260,★★★★,Pay close attention to Williams performance in this.,4,0.167,0.833,0.0,-0.1027
261,★★★½,"Surprising, gripping thriller, with good performances - one of Robin Williams's least-talked-about ones, unfortunately, but he's brilliantly creepy in it.",3,0.066,0.541,0.394,0.8176
262,★★★½,"This was the last Nolan film left for me to see, and I really enjoyed it. Pacino is Pacino and Williams does a good job portraying the killer. Nolan's use of the camera and editing here adds to the thrill of the film, having us question every object and fact- thus achieving what a mystery/ psychological thriller should do. Shot in a beautiful location, and entertaining. 7.6/10",3,0.055,0.723,0.222,0.8977
263,★★★★★,"It's always good to start a Sunday with a piece of good film-making. Even though his body of work is still pretty limited, Chris Nolan remains one of those directors I hold dear to my heart. Always keen on hopping genres and experimenting... and always delivering.",5,0.036,0.698,0.266,0.9042
264,★★★★,"Also, its nice to see Pacino actually in a good film this side of the millennium.",4,0.0,0.695,0.305,0.6908
265,★★★,"The story was a bit predictable, especially the 3rd act. I really couldn't have told you this was directed by Nolan unless I was told before hand. Thoroughly ""meh"", and Swank actually might be a dude. Fact.",3,0.0,0.909,0.091,0.4939
266,★★★★½,"Perhaps me giving this 4.5 is my film bro moment, but I don't care, I really fucking enjoyed this film!",4,0.134,0.583,0.284,0.5936
267,★★★★,seeing robin williams play a murderer was weird but intriguing,4,0.35,0.506,0.143,-0.3506
268,★★★½,nooo al pacino sleep deprivation is bad you must sleeeep,3,0.441,0.559,0.0,-0.743
269,★★★,Nolan's least Nolan film. Al Pacino sleepy.,3,0.0,1.0,0.0,0.0
270,★★½,"This movie seems ordinary and trivial, I guess expectations do sell us short.",2,0.091,0.909,0.0,-0.0258
271,★★½,A decent thriller nothing great but worth a one time watch.,2,0.365,0.529,0.106,-0.449
272,★★★½,im sorry Nolan...I can only suspend my disbelief so much...there is no way in hell that Robin Williams is successfully navigating over that log river,3,0.315,0.591,0.094,-0.7553
273,★★★★,What? The main character's wife is alive? NotMyNolan,4,0.0,0.703,0.297,0.4515
274,★★★,This is a good movie.,3,0.0,0.508,0.492,0.4404
275,★★★½,me tomorrow when my alarm goes off,3,0.286,0.714,0.0,-0.34
276,★★★,one of the worst nolan's movies.,3,0.451,0.549,0.0,-0.6249
277,★★★★,at least now he can sleep!,4,0.0,1.0,0.0,0.0
278,★½,It's not Al anymore. It's Sleep.,1,0.0,1.0,0.0,0.0
279,★★★★,"of course, not what i was expecting from nolan but i quite enjoyed it. i've decided, i'd like chris to direct a horror movie.",4,0.162,0.577,0.261,0.4748
280,★★★★,8/10,4,0.0,1.0,0.0,0.0
281,★★★,"An okay lil crime thriller. Al Pacino gives an unexpectedly spectacular performance, but just about everything else about this movie is pretty middling. What really holds it back, imo, are some of the most basic editing choices, both with regards to what should be extremely simple two-shot conversations between two characters, but also action sequences. It's downright frantic and very annoying- I felt myself almost getting a headache in the first half an hour.",3,0.122,0.795,0.084,-0.6297
282,★★★½,Jokes aside I thought it was a lot of cool buildup with a long and drawn out conclusion. Probably my favorite Robin Williams performance.,3,0.0,0.711,0.289,0.743
283,★★★★,That shitty mob movie actor must have been really excited to work with the grandmaster Nolan.,4,0.177,0.69,0.133,-0.228
284,★★★½,I like Nolan's timey-wimey stuff more but this is still intriguey-weegy! Also his name is Dormer! Spanish/Latin irony!,3,0.069,0.793,0.139,0.3239
285,★★★½,Nothing about this film blows me away but that doesn't mean it's not a damn good movie.,3,0.155,0.7,0.144,-0.0572
286,★★★½,episode.,3,0.0,1.0,0.0,0.0
