,Rating,Comments,overall,negative,neutral,positive,compound
287,★★★,"I thought it had slight technical issues, but I liked it.",3,0.0,0.684,0.316,0.5719
288,★★★½,"Pretty compelling concept and good acting, just felt like it didn't live up to its full potential. Still enjoyed it, though!",3,0.0,0.532,0.468,0.92
289,★★½,This is just not it Nolan,2,0.0,1.0,0.0,0.0
290,★★★½,tried being david fincher and failed,3,0.398,0.602,0.0,-0.5106
291,★★½,pretty boring and confusing ngl,2,0.447,0.213,0.34,0.0
292,★★★★½,the SENIOR CITIZENS are FIGHTING !,4,0.468,0.532,0.0,-0.5461
293,★★★½,Dark secrets hidden in hours of daylight. Pacino plays deliriously tired damn well.,3,0.299,0.481,0.219,-0.3612
294,★★★★,Twin Peaks,4,0.0,1.0,0.0,0.0
295,★★★★,-NOLAN,4,0.0,1.0,0.0,0.0
296,★★★★,"had forgotten how deliciously creepy robin william's performance is in this movie. what a guy, what an actor.",4,0.096,0.758,0.146,0.25
297,★★★★,go to bed,4,0.0,1.0,0.0,0.0
298,★★★,"It's not as memorable as Nolan's other films, so it may feel a little bland in comparison",3,0.0,1.0,0.0,0.0
299,★★★½,It made me sleepy,3,0.0,1.0,0.0,0.0
300,★★★½,A pretty solid & underrated crime thriller.,3,0.327,0.093,0.579,0.1779
301,★★★½,eventually.,3,0.0,1.0,0.0,0.0
302,★★★½,R.I.P LEGEND,3,0.0,1.0,0.0,0.0
303,★★★,"This movie is always entertaining and not entirely run-of-the-mill, but it also doesn't reach for anything really intriguing to me.",3,0.053,0.855,0.093,0.2117
304,★★★★,Wow. This is a very good movie. The characters are good al Pacino's character is unbelievable! The entirety of this film is stressful and thrilling and I love it! Unfortunately the editing isnt great. And there were a couple characters I didnt love. Overall I honestly believe nolan is unable to make a bad movie,4,0.197,0.487,0.317,0.8778
305,★★★★,Happy 80th birthday to the legend himself.,4,0.0,0.619,0.381,0.5719
306,★★★,I just kept waiting for the big reveal and it never came. THE REVEAL NEVER CAME.,3,0.0,1.0,0.0,0.0
307,★★★★,"It's a somewhat slow and straight forward Thriller, that only Nolan and co could elevate into something worthy of anyones time. Simple but elegant delivery.",4,0.0,0.699,0.301,0.7662
308,★★½,Was not expecting this great of a performance from this era of Pacino's career but he knocks it out of the park.,2,0.0,0.872,0.128,0.4474
309,★★★★½,the way that this film so nails the feeling of having to go about your day while your brain is screaming at you because you haven't slept hits way too close to home and feels like a personal attack and mr Nolan will be hearing from my attorney,4,0.108,0.812,0.081,-0.3477
310,★★★½,"Good remake. Hot take, but I prefer serious actor Robin Williams so much more than zany, comedic Williams.",3,0.068,0.656,0.276,0.6647
311,★★★★,Love this film. Great performances all around. Pacino is so good. Williams is incredible. Swank is amazing. If you haven't seen it add it to your watchlist now and pretty please watch it soon!,4,0.0,0.564,0.436,0.9707
312,★★★★,Pacino and Williams excel and their dynamic is compelling and unique.,4,0.0,0.516,0.484,0.7579
313,★★★★,"STOP IGNORING THIS FILM'S PRESENCE, GOD.",4,0.49,0.3,0.21,-0.4215
314,★★★★½,"A fantastic thriller. Along the same lines as Prisoners and Silence of the Lambs. The pacing is not in a hurry, but captures you in a way only Nolan can. Gorgeously shot too with Wally Pfister behind the lens.",4,0.051,0.76,0.189,0.7003
315,★★★½,sklept,3,0.0,1.0,0.0,0.0
316,★★★,"Though I found Insomnia insipid, I don't think it's a bad movie. It just didn't impress me.",3,0.281,0.571,0.148,-0.3728
317,★★★★,"What a great thriller. I'm not sure how much the gimmick adds to it, but it is well-executed, nonetheless. Pacino is great, Swank is great, and Robin Williams is amazing. Lots of twists and turns, and a fun slow burn.",4,0.026,0.542,0.432,0.9781
318,★½,this was boring as hell even tho i love the cast but anyway if al threatened me i would personally die,1,0.454,0.461,0.086,-0.9042
319,★★★½,"It's certainly not a bad film nor is it a great one. But, compared to Nolan's other work it's just a movie that doesn't seem to fit in with his otherwise outstanding work.",3,0.136,0.63,0.233,0.5921
320,★★★,NOW THIS IS POD RACING!,3,0.0,1.0,0.0,0.0
321,★★★½,"This film is a bit of an outlier in Nolan's filmography. Small scale, very little action, very few twists, just a straight-forward murder mystery. Or is it? There's really not a lot to say about this movie, it's never really bad, but it's never great either. The titular insomnia is under-used, and that's a shame. It's a better than average crime movie, but it's not extraordinary.",3,0.21,0.714,0.076,-0.9063
322,★★★★½,What a fucking amazing film! This is by far one of Nolan's best movies and I put it in My Top 3 along with Interstellar and Memento! Wow. Robin Williams and Al Pacino have jaw dropping performances here. What a beautifully crafted film! This movie reminds about why Nolan is one of the best directors of our time.,4,0.0,0.679,0.321,0.9741
323,★★★★,"""Insomnia"" is a dark, nuanced, and thought-provoking slow burn of a crime thriller from Christopher Nolan that features a smart and interesting story, brilliant sense of tone and place, and two great performances from Al Pacino and Robin Williams.",4,0.073,0.622,0.305,0.8807
324,★★★★,"Truly inspired casting, forcing restraint on two of the era's most renown scenery-feasters. We, the audience, know that primal wildness is in there, barely contained, desperate to explode. Nolan exploits that in such a genius manner.",4,0.106,0.747,0.147,0.3976
325,★★★,:3,3,0.0,0.0,1.0,0.5106
326,★★★½,This was better than I was expecting but I think it lost a little by watching it so soon after the original. It was interesting to see what little details they kept the exact same as the original when they changed some pretty big character moments.,3,0.053,0.665,0.282,0.9144
327,★★★★,"I actually hadn't heard of this one from Nolan until I saw it expiring from Netflix. Anyway, it's a decent cop thriller. Hillary Swank is good, Al Pacino turns in a good performance. I always like Robin Williams in roles that kind of blur the lines between good and evil, and he makes a good villain here.",4,0.12,0.647,0.233,0.6705
328,★★★★,"is still an investing crime film with a thoroughly intriguing plot, well developed characters, good tension, and two great performances from Al Pacino and the late Robin Williams. Christopher Nolan has yet to make a film I didn't like.",4,0.167,0.635,0.198,0.3514
329,★★★★½,"Unfairly criticized for simply being a remake in the first place, Nolan makes all the right changes for a mass audience while still making a black and bleak modern noir with one of Pacino's better modern performances.",4,0.067,0.856,0.078,0.1027
330,★★★½,"As much as I did like it, the film could have been significantly better. When you are watching it, it does seem like it could be a really dull, stretched out film and while it doesn't seem like much is going on, it manages to move along at a brisk pace and remains captivating.",3,0.05,0.75,0.2,0.791
331,★★★,"However, Pacino gives an incredible performance.",3,0.0,1.0,0.0,0.0
332,★★★,"One of Nolan's weakest films, though nevertheless holds up nicely. Interesting and engrossing twists and turns amongst the plot, ordinary casting, only two or three satisfactory actors that forthrightly lunged the story forward to a reputable film. The incongruent settings contrasting against each were a strong central point for the film, credit to the production designer for that.",3,0.049,0.743,0.208,0.8658
333,★★★★½,fantastic movie,4,0.0,0.217,0.783,0.5574
334,★★★★★,"al pacino chewing gum to cure anxiety, THAT'S ME!!",5,0.222,0.778,0.0,-0.3147
335,★★★½,GOOD,3,0.0,0.0,1.0,0.4404
336,★★½,Had high expectations but pretty underwhelming.,2,0.0,0.538,0.462,0.6486
337,★★★½,The editing wasn't goo tho,3,0.0,1.0,0.0,0.0
338,★★★★½,"A really solid film on all accounts. I've been giving a lot of 4.5s lately, but I'm proud to if they're all this solid.",4,0.0,0.651,0.349,0.8242
339,★★★,"Dude could have just gotten some melatonin, would've been out in minutes.",3,0.0,1.0,0.0,0.0
340,★★★,"Nolan's worst is still pretty good. Pacino, Swank, and Robin Williams in a boiling pot of Nolan's mind bender stew.",3,0.156,0.611,0.233,0.25
341,★★★★,two of the greatest actors to ever live plus the scenery make this a fantastic movie,4,0.0,0.606,0.394,0.8573
342,★★★½,Nolan Ranking,3,0.0,1.0,0.0,0.0
343,★★★★,"As always, Rest In Peace Robin Williams.",4,0.0,0.632,0.368,0.5423
344,★★★½,poor lil sleep deprived al pacino :(,3,0.695,0.305,0.0,-0.8442
345,★★★★,Christopher Nolan Movies Ranked,4,0.0,1.0,0.0,0.0
346,★★★½,Gaslighting me about not sleeping for 7 days,3,0.0,1.0,0.0,0.0
347,★★½,"also this is my 100th first watch of the year :,)",2,0.0,1.0,0.0,0.0
348,★★★,"Suspenful thriller. Look at director, cast, and executive producers. I enjoyed it. Al Pacino was great being Al Pacino. Beautiful backdrop for movie.",3,0.0,0.586,0.414,0.9136
349,★★★½,This didn't feel like a Nolan film at all but it was still pretty good,3,0.075,0.531,0.394,0.8222
350,★★★★½,It's so weird to see Robin Williams as a bad guy. I mean I'm so used to seeing him in stuff like Mrs. Doubtfire and Good Will Hunting. This shows that he is capable of quite a great range. I thought it was super cool how much they drew parallels between characters that were so different at their fundamental levels. I loved the discussion of how corruption is caused one tiny step at a time. And a discussion of whether or not the ends justify the means and whether or not there become a multiplicity of ends from one means. Incredible film.,4,0.049,0.752,0.199,0.9517
351,★★★½,Production: American > Norwegian (American had more than 2000 times the budget though),3,0.0,1.0,0.0,0.0
352,★★★,just buy a sleep mask Al,3,0.0,1.0,0.0,0.0
353,★★★,Midsommar,3,0.0,1.0,0.0,0.0
354,★,Made by and for idiots. Ashamed to have watched,1,0.279,0.721,0.0,-0.4767
355,★★★★½,This did feel more Fincher than Nolan though... not that this is a bad thing.,4,0.212,0.788,0.0,-0.5423
356,★★★,That was very David Fincher.,3,0.0,1.0,0.0,0.0
357,★★★½,daylight noir <3,3,0.0,0.408,0.592,0.4404
358,★★,Meh,2,1.0,0.0,0.0,-0.0772
359,★★★½,Robin Williams as a bad guy seems strange to me.,3,0.431,0.569,0.0,-0.6486
360,★★★★,"Robin Williams was about as natural a villain as anybody else, and now I need to cry for a bit after remembering his talents.",4,0.229,0.582,0.188,-0.296
361,★★★★,"I loved this movie before, but now that I have been working overnights for more than two years, I truly understand how accurate the level of sleep deprivation is when facing difficulties with daylight sleeping only.",4,0.156,0.694,0.151,-0.0516
362,★★★,"Guy who has only seen Twin Peaks, watching his second mystery: Getting a lot of 'Twin Peaks' vibes from this...",3,0.0,1.0,0.0,0.0
363,★★★★,"Everybody is Al Pacino saying "" let me sleep"" in the last scene every morning.",4,0.0,1.0,0.0,0.0
364,★★★★,Detective Dormer try to sleep challenge,4,0.0,0.794,0.206,0.0772
