,Rating,Comments,overall,negative,neutral,positive,compound
339,★★★★★,[35mm print at The Prince Charles Cinema.],5.0,0.0,1.0,0.0,0.0
340,★★★★½,"A unique thriller with an interesting chronologically-backwards narrative that initially seems gimmicky, but it makes a lot of sense for the slow-burning story and the interesting twist ending that may give you more questions than answers, but they're questions and implications that are fun to think about and make your own conclusions to.",4.5,0.0,0.81,0.19,0.8765
341,★★★★★,The sister's bf is almost as bad as her when it comes to eluding such masterful works of cinema like this one. I'm certainly glad to have this blindspot of his rectified.,5.0,0.082,0.716,0.202,0.5688
342,★★★★,short term memory loss seems like fun,4.0,0.19,0.331,0.479,0.5423
343,★★★★½,I FINALLY FIND THE MASTERPIECE OF NOLAN,4.5,0.0,0.549,0.451,0.6249
344,★★★★½,"Happy 15th Birthday, man!",4.5,0.0,0.429,0.571,0.6114
345,★★★½,i love this movie. would love to understand it someday,3.5,0.0,0.455,0.545,0.8555
346,★★★★,It's really good. I like how Nolan plays with time and gives the audience something to think about. Pretty smart. The story itself isn't the most interesting but I do enjoy this film quite a bit.,4.0,0.042,0.627,0.331,0.8749
347,★★★★★,"*Manny takes a Polaroid picture of Donald Trump and shakes it as Outkast told him many moons ago in the song' ""Hey Ya!"". As the photo develops he writes on the back, ""Don't Believe His LIES."" He puts the picture back in his pocket and dyes his hair bleach blonde to look as cool as Guy Pearce.*",5.0,0.0,0.955,0.045,0.3802
348,★★★★★,I've seen this movie so many times and I always think I know everything that happens but then I watch it again and some shit I have absolutely no recollection of shows up and blows my mind and I gotta rethink my entire life again.,5.0,0.176,0.824,0.0,-0.8458
349,★★★★½,"This is one of the greatest Thrillers I've ever seen. Even without the ambitious storytelling method, the characters and what they go through is so well written. Now I really want to see a version edited in chronological order.",4.5,0.058,0.724,0.218,0.7253
350,★★★★½,i'm going to convince myself that i understood what happened in this movie,4.5,0.0,0.846,0.154,0.25
351,★★★★★,"I can't believe it took me so long to finally watch this. I was completely hooked and even though I had accidentally seen spoilers for the end, I still enjoyed the journey getting there and the revelation was incredible.",5.0,0.062,0.853,0.085,0.2263
352,★★★★★,"Christopher Nolan uses a fractured narrative to tell an interesting story and create a modern masterpiece. A literal brainteaser that forces the viewer to watch multiple times to truly comprehend what they've witnessed and find something new each time. Absorbing, complex, heartbreaking, thrilling, inventive, and terrific neo-noir.",5.0,0.052,0.638,0.31,0.9325
353,★★★★★,this live action of finding dory is amazing,5.0,0.0,0.648,0.352,0.5859
354,★★★★½,"Visiting this movie after almost 4 years, gaining a lot of perspective between that time and I have to say Nolan is still a genius, the context with which I might've said earlier would've been different but the sentiment is pretty much the same. Still holds up brilliantly after all these years, much more tightly structured than I remember it to be and a lot more nuanced than I expected. Maybe my dispassion towards Nolan these past few years have been unfounded after all.",4.5,0.0,0.863,0.137,0.9111
355,★★★★½,BRUH THE ENDING IS NUTS the way it connects and lying to yourself and omg that ending,4.5,0.3,0.7,0.0,-0.7531
356,★★★★★,polaroids and stick 'n' pokes? leonard is a hipster piece of shit. #outed,5.0,0.247,0.753,0.0,-0.5574
357,★★★★½,"Memento is brilliantly complex - the use of narrative and non-linear plot, the slow unravelling of the events, the use of contrasting black and white and full colour sequences to tell different intertwining plots - everything about it is so original and intriguing. Guy Pearce is brilliant, I haven't enjoyed any of his recent roles but now that I've seen this I definitely think a lot more of him.",4.5,0.026,0.82,0.154,0.8493
358,★★★★½,gaslighting: the movie,4.5,0.0,1.0,0.0,0.0
359,★★★★½,the writing really immerses the audience into what the main character is feeling in such a seamless way,4.5,0.0,0.914,0.086,0.128
360,★★★★,I'm sorry for everything bad I've ever said about Ending Explained video essays.,4.0,0.304,0.696,0.0,-0.5859
361,★★★★½,I feel like this gets better with every rewatch. So good.,4.5,0.0,0.449,0.551,0.8221
362,★★★★½,god christopher nolan you really love making me feel stupid until the last 5 minutes of your movies,4.5,0.142,0.584,0.275,0.4927
363,★★★★,fucking david fincher .........,4.0,0.0,1.0,0.0,0.0
364,★★★½,Was like a first time watch as it seems my long term memory has gone for this film. Both a hypnotic and frustrating film as Nolan again puzzles his audience with the non-linear time frame. It's a hell of ride while watching though.,3.5,0.16,0.787,0.053,-0.7184
365,★★★★★,Nolan ranked,5.0,0.0,1.0,0.0,0.0
366,★★★★,"I also very much enjoy Guy Pearce in the lead role. And it's just such a fun, intriguing movie that doesn't feel like it's doing too much. I can only imagine it'll grow on me in the coming weeks.",4.0,0.05,0.788,0.162,0.6877
367,★★★★½,Nolan was like what if I made one massively poggers film and then just never did it again,4.5,0.0,0.865,0.135,0.3612
368,★★★★★,i just found my new favourite nolan movie. holy shit,5.0,0.31,0.69,0.0,-0.5574
369,★★★★★,Do I lie to myself to be happy?,5.0,0.0,0.619,0.381,0.5719
370,★★★★½,chris nolan's hairpin explanation for this film is genius i am in awe of this man,4.5,0.0,1.0,0.0,0.0
371,★★★★★,FKSLDKCSMDJWJD I WANNA SCREAM,5.0,0.574,0.426,0.0,-0.4019
372,★★★★,So many early Nolan-isms.,4.0,0.0,1.0,0.0,0.0
373,★★★★½,"time to watch this again in the future, but I regret waiting so long to watch this. Nolan never misses.",4.5,0.163,0.749,0.088,-0.4021
374,★★★½,"-Joe, giving me a bloody nose after I said this felt kinda slow",3.5,0.203,0.629,0.168,-0.128
375,★★★★½,"Memento is an absolute mind-bender. Even after multiple viewings I still am not certain as to what actually happened. Nevertheless, the story is told is such a unique and compelling way that it keeps you glued to the screen the entire time. Christopher Nolan's story would have been interesting enough told in a straightforward way, but telling it backwards & forwards at the same time was as stroke of genius.",4.5,0.021,0.93,0.049,0.2247
376,★★★★,"Thriller atrapante, gran actuacion de Guy Pearce, geniales planos de Nolan en blanco y negro su direccion siempre Masterpiece.",4.0,0.0,0.744,0.256,0.6705
377,★★★★★,"Also Happy Chapman from Garfield The Movie is in this, so what's not to love.",5.0,0.168,0.648,0.184,0.0854
378,★★★★★,I think Nolan should do a small budget film again. His budgets and concepts keep growing and are starting to overshadow his characters. His characters are just turning into plot devices. Just my humble opinion.,5.0,0.0,0.95,0.05,0.1779
379,★★,is this what the heterosexuals on reddit masturbate to,2.0,0.0,1.0,0.0,0.0
380,★★★½,in order for me to PERFECTLY understand a Nolan film in just the first viewing? seriously what? asking for a friend (and myself)....,3.5,0.06,0.638,0.301,0.8313
381,★★★★,"I was stressed tf out, it has gotten to the point where I felt like I wanted to find out the truth more than Leonard himself, and honestly, this movie is the reason why I have trust issues.",4.0,0.056,0.682,0.261,0.8271
382,★★★★½,"I had a great idea for a review, but then I forgot it :(",4.5,0.267,0.556,0.177,-0.3182
383,★★★★½,"cinematic gold, nolan does it once again. i can't emphasize enough the genius of his filmmaking. truly, his best film.",4.5,0.0,0.705,0.295,0.7964
384,★★★★½,It introduced me to the idea of subjective memory and therefore subjective truth. It may be flawed - running a little ragged in the middle - but that profound idea always strikes a chord for me.,4.5,0.093,0.86,0.047,-0.3818
385,★★★★½,Not a film that is well served by reviewing and I'm probably the last person in the world to see it anyway. It's excellent. You knew that.,4.5,0.0,0.805,0.195,0.7003
386,★★★★½,"A third, reluctant viewing ended up being the ticket to me finally loving this film. Feel free to mock me for how wrong I was all this time",4.5,0.219,0.582,0.199,0.0772
387,★★★★★,"Most probably my favorite movie ever. Nolan plays with the plot like a modern Homer, Guy Pearce travels through his memories like a modern Ulysses and after the movie ends, like Kavafis ""Ithaca"", you are full of questions but you feel clean - just like after an ancient greek tragedy.",5.0,0.1,0.642,0.258,0.679
388,★★★★,film number 200 of the year!!,4.0,0.0,0.726,0.274,0.2225
389,★★★,"LOL ""Meme""nto",3.0,0.0,0.221,0.779,0.5473
