,Rating,Comments,overall,negative,neutral,positive,compound
165,★★★★½,One of the GREATEST mystery movie ever made. Script and directing style complement each other perfectly. One of Nolan's best works.,4.5,0.0,0.574,0.426,0.9364
166,★★★★½,Next Review: Blinded By The Light,4.5,0.0,1.0,0.0,0.0
167,★★★★½,"officially back on the nolan train. loved everything about it this time. the standout performance here is carrie anne-moss. if the world was a good place, she would be the biggest star along keanu reeves.",4.5,0.0,0.825,0.175,0.7783
168,★★★★★,@ christopher nolan u amaze me every single time,5.0,0.0,0.632,0.368,0.5423
169,★★★★★,i don't know what happened but i know that i loved it,5.0,0.0,0.599,0.401,0.7469
170,★★★★★,Alabado sea Nolan.,5.0,0.0,1.0,0.0,0.0
171,★★★★★,"Spectacular, one of those films that don't let you relax for a second, dizzying, full of details, bravo Nolan.",5.0,0.124,0.876,0.0,-0.3412
172,★★★½,"Annoying movie, the mystery is not interesting enough to warrant this kind of format, it has no rhythm at all.",3.5,0.296,0.704,0.0,-0.7317
173,★★★★,the first fifteen minutes were great but i can't remember anything else :(,4.0,0.235,0.61,0.155,-0.3182
174,★★★½,"certainly commendable on being scientifically accurate (at least on what we know so far) about the neurobiology of memory, but once the awe of the nonlinear narrative structure begins to wane, nothing of the film's story remains with you as if the film itself fades like one of Leonard's temporary memories.",3.5,0.0,0.908,0.092,0.6059
175,★★★★½,Still holds much of the same power for me. Mesmerizing cinema from a new filmmaker announcing his presence and intentions. I would say that Nolan definitely lived up to the hype.,4.5,0.0,0.912,0.088,0.4019
176,★★★★½,[Christopher Nolan ranked],4.5,0.0,1.0,0.0,0.0
177,★★★★,also fuck natalie!,4.0,0.655,0.345,0.0,-0.5848
178,★★★★★,. Brad pitt gives a great performance tho,5.0,0.0,0.549,0.451,0.6249
179,★★★★½,"has made my mind go through an acid trip battle that all I want to do, is go through it again.",4.5,0.119,0.822,0.059,-0.3182
180,★★★★★,"I am reeling. Christopher Nolan is a genius. I wish he would go back to directing small-scale stories like this one, not that his massive tales are worse, but I'd love to see a return to form for him. That single moment where Leonard shakes the polaroid and the film shifts from black and white to color gave me goosebumps. It's just a small stroke of pure filmmaking mastery.",5.0,0.029,0.84,0.132,0.81
181,★★★½,"nope, running away from him""",3.5,0.0,1.0,0.0,0.0
182,★★★★★,"""no... he's chasing me""",5.0,0.0,1.0,0.0,0.0
183,★★★★½,"I tended to lean towards the ""this is overrated"" camp on this one, but watching it again this time it clicked a little better, I like the way it rides on waves of emotion underneath its gimmicky (but logical and effective!) narrative schematic. I still think it botches Carrie-Anne Moss' character though.",4.5,0.0,0.876,0.124,0.7604
184,★★★★,My brain hurts from all of this,4.0,0.341,0.659,0.0,-0.4767
185,★★½,Rating: 44/100,2.5,0.0,1.0,0.0,0.0
186,★★★,"This movie is actually much better in chronological order (available on the special edition DVD as a hidden extra), which kinda renders the whole reverse-storytelling thing a gimmick. Would be so much better with more focus. Example: get rid of the completely extraneous Dodd sequence and flesh out the actual characters and their relationships and motivations a bit more instead of pissing around with dumb filler.",3.0,0.086,0.797,0.117,0.3041
187,★★★★½,Wow... this film is truly something else! Memento demands multiple viewings in order to fully appreciate the unique and original structure and narrative. Love how Christopher Nolan challenges us intellectually and makes us become an active participant even though we feel disoriented because of the non-linear structure. Makes us feel like we have Leonard's condition.,4.5,0.036,0.656,0.308,0.9523
188,★★★★★,literally one of the best movies ever,5.0,0.0,0.588,0.412,0.6369
189,★★★★,Someone please get me an aspirin,4.0,0.0,0.685,0.315,0.3182
190,★★★★,"@sussy baka if you're reading this, watch this, I'm sure you'll love it (hopefully)",4.0,0.0,0.649,0.351,0.7579
191,★★★★½,P.S. - Guy Pearce is so good.,4.5,0.0,0.572,0.428,0.5777
192,★★★★★,Arguably one of the most brilliant movies ever made. Absolute masterpiece.,5.0,0.11,0.44,0.45,0.8016
193,★★★★,#HaikuFilmReview,4.0,0.0,1.0,0.0,0.0
194,★★★★½,Chill. Absolute chills every time.,4.5,0.0,1.0,0.0,0.0
195,★★★★½,me throughout this movie: BRO WHAT,4.5,0.0,1.0,0.0,0.0
196,★★★½,"*tattoos on my arm ""not a movie about getting into memes""*",3.5,0.0,1.0,0.0,0.0
197,★★,"Early on, before they revealed the backstory behind his tattoos, I was a massive subscriber to the theory that Carrie-Ann Moss & Joe Pantoliano found Guy Pearce unconscious after the inciting incident & effectively vandalized his body, getting him tatted with random pointless bullshit and scribbling on him with aimless instructions & facts & conspiracies just to fuck with him",2.0,0.119,0.833,0.047,-0.6597
198,★★★★★,THIS FILM IS SO CLEVER I CANT GET OVER IT. I LOVE THIS FILM OH MY.,5.0,0.0,0.616,0.384,0.8173
199,★★★★½,"Last seen more than 10 years ago, this one aged quiet a bit. Anyway still the ground solid narrative one trick pony with minimalistic style and a sweet flow. I did forget how much Nolan was (and still is) into pure Genre Cinema.",4.5,0.071,0.824,0.105,0.3612
200,★★★★★,"I remember being absolutely floored by this movie after initially seeing it, but after several years of distance and being even more amazed at Nolan's subsequent work, I wondered if this movie would still work, knowing the outcome. I'd dare say this I enjoyed this movie even more the second time, mostly on account of Guy Pearce's amazingly sarcastic, droll, wiseass performance. I find it unbelievable that he has yet to be nominated for an Oscar, as he has repeatedly pulled out one incredible performance after another.",5.0,0.072,0.802,0.126,0.7365
201,★★★★★,i kneel for absolutely no one but i would kneel for carrie anne moss if she told me to,5.0,0.098,0.902,0.0,-0.1893
202,★★★★½,haoW,4.5,0.0,1.0,0.0,0.0
203,★★★★½,grade: A,4.5,0.0,1.0,0.0,0.0
204,★★★★½,*Ending = Beginning? Whatever.,4.5,0.0,1.0,0.0,0.0
205,★★★★★,"As someone who was never a fan of Christopher Nolan's filmography in the first place, I thought Memento was legitimately fucking great. I also regret that I should have watched it much more earlier.",5.0,0.138,0.741,0.121,0.0944
206,★★★★,Definitely one that I'll need to re-watch a few times before I can fully understand it. It's pretty fantastic though and I loved the sdrawkcaB structure of it,4.0,0.0,0.61,0.39,0.9246
207,★★★★½,Nolan Ranked,4.5,0.0,1.0,0.0,0.0
208,★★★★★,simplemente genial,5.0,0.0,0.263,0.737,0.4215
209,★★★★½,.gnisufnoc os os OS,4.5,0.0,1.0,0.0,0.0
210,★★★★★,"I kinda wish Christopher Nolan went back to making more Character driven films like Memento, Dark Knight, or the Prestige. And even though I still consider Dunkirk to be Nolan at his best I still think this movie is pretty close to my favorite Nolan film.",5.0,0.0,0.713,0.287,0.9361
211,★★★★★,being confusing the heck out of me,5.0,0.241,0.759,0.0,-0.2263
212,★★★½,[nickelback voice] look at this photograph,3.5,0.0,1.0,0.0,0.0
213,★★★★★,. Incredibly unique and wholly original. No film quite like it. Masterpiece through and through.,5.0,0.102,0.462,0.437,0.8051
214,★★★,"i don't even give a shit about the film i was more fascinated by cronly norland's obsession with dumbass character names with two of the same letter next to each other (Lenny, Teddy, Jimmy, Dodd, Sammy, Emma) as well as the fucking HILARIOUS credits music that i initally described as ""btec radiohead"" to later find out to be DAVID BOWIE LMFAOOO and fucking MICHELLE ""MUGGS"" PAPPAS and STEVE ""SHOE"" SHOEMAKER in the credits honest to god i had more fun wheezelaughing at the credits than i did the entire movie LOL",3.0,0.054,0.649,0.297,0.9776
215,★★★★★,"synonyms: gem, showpiece, master work, treasure, perfection.",5.0,0.0,0.459,0.541,0.7096
216,★★★★½,"Potentially Nolan's best, a two hour mindfuck that leaves you reeling in the credits. I forgot just how good this film is and how clever Christopher Nolan really is.",4.5,0.0,0.646,0.354,0.9118
217,★★★★★,Rewatching my favourite Nolan film in celebration of the big man's birthday!,5.0,0.0,1.0,0.0,0.0
218,★★★★,it's embarrassing how much brain power it took for me to follow this plot,4.0,0.167,0.833,0.0,-0.3818
219,★★★★★,10/10,5.0,0.0,1.0,0.0,0.0
220,★★★★½,Bruh,4.5,0.0,1.0,0.0,0.0
221,★★★★★,"If Nolan can pull time off in 'Tenet' half as good he does in this, we will have a true masterpiece on our hands",5.0,0.0,0.671,0.329,0.8689
222,★★★★★,"Memento is certainly an odd movie, but damn was is it ever amazing. Easily Christopher Nolan's best movie in my opinion.",5.0,0.144,0.417,0.439,0.9118
223,★★★★,Has anyone ever done their brother a solid as much as this getting nominated for Best Screenplay? Because I doubt it,4.0,0.103,0.658,0.239,0.5106
224,★★★★★,David Julyan > Hans Zimmer,5.0,0.0,1.0,0.0,0.0
225,★★★½,Forgot this movie and had to be sure I saw it before,3.5,0.0,0.813,0.187,0.3182
226,★★★★★,"-search ""Memento explained"" on youtube-",5.0,0.0,1.0,0.0,0.0
227,★★★★★,is my first review.,5.0,0.0,1.0,0.0,0.0
228,★★★★,"Honestly, I just feel bad for the editor.",4.0,0.304,0.435,0.261,-0.128
229,★★★★,My brain is literally noodles,4.0,0.0,1.0,0.0,0.0
230,★★★★★,"its literally PERFECT (to me, despite some teeny tiny issues). i loved it a lot. one of my favourites from Nolan now.",5.0,0.0,0.684,0.316,0.8531
231,★★★★½,also I wonder what this movie would be like if someone edited it in reverse so we could see everything happen chronologically,4.5,0.0,0.889,0.111,0.3612
232,★★★★½,"Love the twist, love how Nolan managed to incorporate the non-linear structure without it seeming gimmicky, where it actually makes sense to the narrative. Very interesting movie. Would love to rewatch soon.",4.5,0.0,0.642,0.358,0.9485
233,★★★★,.look best Pearce's Guy be gotta has This,4.0,0.0,0.625,0.375,0.6369
234,★★★★★,basically the most original movie i've ever seen,5.0,0.0,0.73,0.27,0.3804
235,★★★★,probably some of the most impressively detailed writing ever. mathematical precision.,4.0,0.0,0.752,0.248,0.5095
236,★★★½,I didn't really find it terribly compelling though? Lenny has like zero personality and I could only ever be invested in his story to the point of getting the answers not because I really cared about him getting whatever he needed out of it.,3.5,0.134,0.774,0.092,-0.4611
237,★★★★★,I have no fucking clue what just happened but all i know is that i really loved this film. I love getting mind fucked by Christopher Nolan yikes.,5.0,0.196,0.509,0.295,0.7086
238,★★★★½,I was confused the whole way through and I loved it.,4.5,0.174,0.53,0.295,0.3818
239,★★★★★,Nolan's most BIG BRAIN film! This is his most poggers film. The best mystery easily. Irreversible compared to this is basically a 1/10. Nolan's other film's compared to this are basically worst than The Room. Easy 10! One of the most unpredictable movies ever made! I've seen it 5 times and it's still extremely entertaining! Also I forgot how great the score was for this!,5.0,0.075,0.697,0.228,0.9195
240,★★★★½,My brain is absolutely fried but very good movie,4.5,0.0,0.651,0.349,0.6474
241,★★★★,Nolan's most emotional movie and that's why it's still good even though I'm over these mindfuck movies.,4.0,0.0,0.758,0.242,0.5849
242,★★★★★,Went into this movie completely blind and was floored. What a puzzling film in the best way.,5.0,0.141,0.661,0.198,0.2975
243,★★★★,christopher nolan always has me on google the second after i finish one of his movies looking for the ending explained,4.0,0.0,1.0,0.0,0.0
244,★★★★,nolan machista sempre matando as esposas dos protagonistas,4.0,0.0,1.0,0.0,0.0
245,★★★★,if my life was like this I'd simply give up lol,4.0,0.0,0.629,0.371,0.6486
246,★★★★★,loved everything understood nothing,5.0,0.0,0.435,0.565,0.5994
247,★★★★,the premise of this film and the way it's told is so unique i love it. it's absolutely amazing to me that someone could come up with this concept.,4.0,0.0,0.752,0.248,0.8615
248,★★★,i wish i was smarter,3.0,0.0,0.149,0.851,0.6908
249,★★★★,it's a such interesting movie with a great screenplay.,4.0,0.0,0.424,0.576,0.7783
250,★★★★,My brain is broken. Seeing Ralphie from Sopranos pop up in this just made me remember how much of a shit he was ngl,4.0,0.242,0.758,0.0,-0.7717
251,★★★★,"masterfully made, just like all Nolan films, but deep down, this is nothing but a twisted mystery/thriller film. i was expecting a lil more - i only really started loving Memento in its last 45 minutes, and the ending was haunting. not the strongest 8/10 tho",4.0,0.115,0.736,0.15,0.4134
252,★★★★,i understood everything ?? am i SMART ????,4.0,0.0,0.532,0.468,0.659
253,★★★★,"Let me ask you this. Do you lie to other people to avoid the pain of knowing the truth? And, do you lie to yourself, and believe something that is not true, just to make yourself be happy for a brief moment?",4.0,0.163,0.717,0.12,-0.2942
254,★★★★½,the fucking effort that the editing team put into this......i could cry,4.5,0.22,0.78,0.0,-0.4767
255,★★★★★,movie a of masterpiece fucking A.,5.0,0.0,0.494,0.506,0.6249
256,★★★★★,Christopher fucking Nolan stop playing with my fucking brain!,5.0,0.234,0.592,0.174,-0.1795
257,★★★★★,"Please Hollywood, don't remake it!",5.0,0.0,0.607,0.393,0.3802
258,★★★★,"Like Inception except this is MORE mind-bending, Memento plays with your mind crazy and you have to keep your eyes glued and ears wide open in order to get it, you cannot miss one bit of the movie especially the very beginning. This was Christopher Nolan's second film of his career and just a great unique & clever film. One of those rare films that goes backwards and goes forward as the movie goes on and it's effective.",4.0,0.027,0.78,0.193,0.9283
259,★★★★★,damn he has good handwriting,5.0,0.314,0.349,0.337,0.0516
260,★★★★,these matrix sequels are getting crazy man.... also i loved when people pointed out leonard's designer suit as if he wasn't cosplaying walter white for most of the movie,4.0,0.074,0.805,0.121,0.3612
261,★★★★,i may be confused but i already know this is gonna SLAP on a rewatch,4.0,0.113,0.683,0.205,0.329
262,★★★★½,"This film is amazing and fucks with your mind, memento is better then inception !",4.5,0.147,0.522,0.332,0.5983
263,★★★★,props to the editing team! this must've been such a pain in the ass to edit,4.0,0.353,0.647,0.0,-0.7959
264,★★★★,this movie is actually about me when i get too high and have to leave reminders for myself in my notes app,4.0,0.057,0.943,0.0,-0.0516
265,★★★★,"have been meaning to watch this for years and kept putting it off because the subject matter was so uncomfortable, until me and my bf started watching a b99 episode earlier that kept referencing memento and i refused to get spoilers... so we stayed up till 5:30 watching this just so we could finish the last 10 or so minutes of the episode",4.0,0.079,0.904,0.017,-0.6115
266,★★★★½,tell me why i thought brad pitt was in this film not guy pearce,4.5,0.0,1.0,0.0,0.0
267,★★★★½,el final,4.5,0.0,1.0,0.0,0.0
268,★★★★,tattoo:watch memento,4.0,0.0,1.0,0.0,0.0
269,★★★★,I HATE U CHRISTOPHER NOLAN SO MUCH JUST MAKE A NORMAL STRAIGHT FORWARD MOVIE I BEG OF YOU,4.0,0.21,0.682,0.108,-0.4215
270,★★★★★,my roommate was watching this for the first time and i loved watching his reactions throughout the whole movie,5.0,0.0,0.813,0.187,0.5994
271,★★★★★,another Nolan masterpiece!!!!!!!!!,5.0,0.0,1.0,0.0,0.0
272,★★★★★,Score: 10/10,5.0,0.0,1.0,0.0,0.0
273,★★★★½,"Well Done, Christopher Nolan.",4.5,0.0,0.588,0.412,0.2732
274,★★★★½,What the fuck.,4.5,0.636,0.364,0.0,-0.5423
275,★★★★,LOVE the screenplay.,4.0,0.0,0.288,0.712,0.7125
276,★★★★★,One of the most well crafted films of all time. I can't believe that it works as well as it does. It's a movie that requires you to pay attention and to use your brain to follow the story. I wish I could make a movie this good one day.,5.0,0.027,0.765,0.208,0.8577
277,★★★½,"One of Nolan's first film that is both a cleverly made and unconventional thriller and acts as a good introduction to his style, recurring themes and motifs that would be find in the rest of his filmography. Not my favorite in Nolan's excellent filmography so far but still very good.",3.5,0.031,0.76,0.208,0.8299
278,★★★★,and i love it,4.0,0.0,0.323,0.677,0.6369
279,★★★★★,[[DO NOT BELIEVE HIS LIES]],5.0,0.0,1.0,0.0,0.0
280,★★★★½,youtu.be/eyK7T-7vCro,4.5,0.0,1.0,0.0,0.0
281,★★★★,why is there a tattoo on my chest that says i got pregnant from watching this???,4.0,0.0,1.0,0.0,0.0
282,★★★,christopher nolan: so how can i make this next scene even more CONFUSING as fucking possible........,3.0,0.173,0.827,0.0,-0.4453
283,★★★★★,This film is a masterpiece,5.0,0.0,0.423,0.577,0.6249
284,★★★★★,Easy 5 stars. I like Christopher Nolan a lot and Memento is easily some of his best work. This and Inception are my favorites of his. Probably Guy Pearce's best role. Great non-linear story telling with enough layers to warrant many rewatches.,5.0,0.0,0.581,0.419,0.9723
285,★★★★★,"Memento is a truly original, exciting, and gripping neo-noir psychological thriller from writer/director Christopher Nolan, with fantastic performances, terrific direction, and engaging characters.",5.0,0.0,0.442,0.558,0.9509
286,★★★★½,I haven't seen this in years and it held up very well.,4.5,0.0,0.807,0.193,0.3384
287,★★★★★,Classic.,5.0,0.0,1.0,0.0,0.0
288,★★★★,"Christopher Nolan, please just have sex with a clock and get this obsession with time over with.",4.0,0.144,0.735,0.121,-0.1154
289,★★★★,"other than that, pretty good. i have a massive headache :)",4.0,0.0,0.397,0.603,0.8442
290,★★★★★,I miss the good old days when Christopher Nolan used the f-word,5.0,0.119,0.667,0.215,0.3182
291,★★★★★,"Man, I can't wait for the remake!",5.0,0.0,1.0,0.0,0.0
292,★★★★★,Now where was I?,5.0,0.0,1.0,0.0,0.0
293,★★★★★,genuis strategic a is Batman Nolan's,5.0,0.0,1.0,0.0,0.0
294,★★★★★,"my sister came into the room, said ""wow, he's attractive!"" and left. she didn't lie.",5.0,0.0,1.0,0.0,0.0
295,★★★★,Final Verdict: B,4.0,0.0,0.385,0.615,0.1531
296,★★★★½,every character in this film looks like a combination of at least 3 inglourious basterds characters,4.5,0.0,0.839,0.161,0.3612
297,★★★★½,what the actual fuck!!! i feel like this gave ME a brain injury just trying to understand wtf just happened,4.5,0.399,0.51,0.091,-0.8582
298,★★★★★,I would love to see someone try and make a film like this today cause this movie is truley one of a kind,5.0,0.0,0.627,0.373,0.8779
299,★★★,i hate you christopher nolan i hate you so much,3.0,0.552,0.448,0.0,-0.8126
300,★★★★½,that opening scene w the inversion was a tenet tease but 20 years early,4.5,0.13,0.87,0.0,-0.1655
301,★,"Ugly in its insincerity; speaks of the poetry of certainties and details we take for granted and the range of emotions in Pearce's Lenny, then hardens details into events, pieces to be solved, and treats people as objects. Makes me nauseous.",1.0,0.119,0.755,0.126,-0.1779
302,★★★★★,this movie just became one of my favorites of all time,5.0,0.0,0.781,0.219,0.4215
303,★★★★★,"Very strange that I hadn't seen this but finally got around to it! Was literally everything I wanted it to be! Incredible performances from all of the cast, specifically Guy Pearce. He seriously played his character to perfection, never feeling unbelievable in a single scene. The order in which the film takes place is totally bonkers and absolutely broke my brain. Also, the ending is just TOO good to deny. Loved it a lot, will definitely be watching it again soon!",5.0,0.14,0.647,0.213,0.9099
304,★★★★½,ralphie cannot be trusted,4.5,0.46,0.54,0.0,-0.3724
305,★★★½,slightly confusing but enjoyable nonetheless,3.5,0.168,0.387,0.445,0.4855
306,★★★★½,"pulls it off with ease thanks to Christopher Nolan and his meticulous storytelling. Despite the number of times I've watched this movie over the years, the puzzle always remains a captivating and fresh experience.",4.5,0.032,0.765,0.203,0.7564
307,★★★★★,"The way this movie is structured, just might be genius.",5.0,0.0,1.0,0.0,0.0
308,★★★★½,Nolan never disappoints,4.5,0.0,0.478,0.522,0.2924
309,★★★★★,My brain hurts.,5.0,0.608,0.392,0.0,-0.4767
310,★★★★½,You know it's a Nolan movie when your brain is in a fucking knot afterwards,4.5,0.0,1.0,0.0,0.0
311,★★★★,2000 Films Ranked,4.0,0.0,1.0,0.0,0.0
312,★★★★★,"Hot take: What happened to THIS guy? The director of Memento and The Prestige? Tightly controlled worlds, little puzzle boxes. I know you're ""supposed"" to keep making big budget pictures while you can, because the opportunities are fleeting, but it's been 20 years. It's a great career. Make a ""little gem"" again, Mr. Nolan. Those will outlast the Interstellars-DKRs of history.",5.0,0.0,0.878,0.122,0.8321
313,★★★★,i need to ...sit down,4.0,0.0,1.0,0.0,0.0
314,★★★★½,memento we are getting you back from filmbros,4.5,0.0,1.0,0.0,0.0
315,★★★★,Okay... Christopher Nolan did that...,4.0,0.0,1.0,0.0,0.0
316,★★★★★,"It had been so many years since I saw this, that it really was like I was witnessing it all over again for the very first time. That just made this rewatch really something so rewarding and even legitimately surprising. Nolan always knows how to get inside my head apparently.",5.0,0.0,0.825,0.175,0.8616
317,★★★★½,christopher edward nolan: you never specified how MUCH closure so...,4.5,0.0,1.0,0.0,0.0
318,★★★★★,"Its about time I re-watched one of my favorite films of all time. Memento is my favorite Christopher Nolan film as well. In his second outing as director, Nolan continues to show off his nonlinear story telling style. This movie not only makes you want to watch it again, but requires you to with its plot made complex by subjecting you to the point of view of the protagonist who lives without short term memory. Memento is the best example in Nolan's excellent filmography of how he refuses to pander to the masses.",5.0,0.0,0.831,0.169,0.9481
319,★★★★,The story is about a man who has no long term memory tries to piece together his life and finds things are not as they seem. This movie has really clever writing and great acting.,4.0,0.054,0.764,0.182,0.7346
320,★★★★★,Christopher Nolan Ranked,5.0,0.0,1.0,0.0,0.0
321,★★★★,me: alright time to go on reddit,4.0,0.0,0.75,0.25,0.25
322,★★★★★,"Was soll ich nur sagen, dieser Film ist einfach immer wieder ein Genuss und ganz zu Recht heute bereits Kult.",5.0,0.0,1.0,0.0,0.0
323,★★★★,spent so much of this viewing experience crippled by the thought of how easily a person in this situation would be taken advantage of and how scared i am of this happening to me!!! anyway i already need to rewatch this. if i was leonard i would simply have created a note on my iphone,4.0,0.053,0.816,0.132,0.5229
324,★★★½,"Crazy lenny... Cool but I think I wasn't in the mood so 3.5/5... I promise, I will rewatch this film!.. Bajingan jadi semua kemumetan ini demi kepuasan pribadinya si nganu. Kaga waras si ni orang wkwk.. Inget gaes, jangan ngantuk pas nonton ini. Kudu konsen lho...",3.5,0.037,0.848,0.115,0.5588
325,★★★★½,"This just hit me in the head, and now I got this condition. I've told you this before, haven't I? Because, this slaps! From 2.5 this is now 4.5. Love that feeling. Wait, I need to take a screenshot in case my memory fades.",4.5,0.0,0.867,0.133,0.7177
326,★★★★★,Lactose intolerance is a bithc,5.0,0.0,1.0,0.0,0.0
327,★★★★★,Guy Pearce is hot,5.0,0.0,1.0,0.0,0.0
328,★★★★★,"It's strange, idk why but this morning when i woke up it seems that i've written on my hands to edit the movie file in reverse order",5.0,0.098,0.902,0.0,-0.1531
329,★★★★½,how does someone just like come up with this idea one day i literally cannot comprehend this,4.5,0.0,0.857,0.143,0.3612
330,★★★★½,p.s.s. i readily obliged her tho,4.5,0.0,1.0,0.0,0.0
331,★★★★★,this film + 3 cups of coffee = the worst possible headache you could imagine,5.0,0.272,0.728,0.0,-0.6249
332,★★★★½,Name every memory,4.5,0.0,1.0,0.0,0.0
333,★★★★½,wp.me/pat7iE-2nT,4.5,0.0,1.0,0.0,0.0
334,★★★★½,uh holy fuck? i literally finished it and immediately went back to the beginning,4.5,0.226,0.774,0.0,-0.5423
335,★★★★★,Now where was I?,5.0,0.0,1.0,0.0,0.0
336,★★★★,kcuf eht tahw,4.0,0.0,1.0,0.0,0.0
337,★★★★½,youtu.be/pPMdwFcDDrQ,4.5,0.0,1.0,0.0,0.0
338,★★★★★,Christopher Nolan Ranked,5.0,0.0,1.0,0.0,0.0
