,Rating,Comments
249,½,I'm passionate about art.. About cinema.. I honestly just feel sad and upset. I'm giving it half a star but it is really a zero.
250,★★,christopher nolan you will never savour.
251,★★★★★,CLOSE THE OP-ER-A
252,★★★★★,"one thing for sure, i like ludwig goransson score"
253,★★★,"PS: Make sure subtitles are turned on, or you'll probably miss a large chunk of the dialogue."
254,★★★★,www.b9.com.br/136625/tenet-christopher-nolan-critica-review/
255,★★★,"Emotionally empty, high-concept, big-budget, shot on IMAX, fever-dream."
256,★★★★,"I have seen Tenet for the third time now and I think I have understood the context almost completely. A detail that I have only now noticed, and what really moves me is this: when time runs out so relentlessly and every second seems to count: how the hell do people find the time to shave such outrageously accurate trimmed beards?"
257,Watched by,i truly had no idea what was going on and also my ears are ringing
258,★★★★,"wow the movie was great, can't wait for the trailer to release now"
259,★★★★,And Kick Ass is in it .
260,★★★½,me 2 seconds later: fuck nevermind
261,Rewatched by,starting TENET exactly at 12:29 AM on Sunday November 7th so you hit daylight savings when The Protagonist enters the inverted world
262,★★★★★,I wrote more about this one here.
263,★★★★,yesterday i found out that neil is kat's son and i haven't been the same since
264,★★★½,"I enjoyed this, although it was pretty confusing and dialogue was hard to make out a lot of the time. Probably will make more sense if I rewatch it with a temporal pincer movement. My future self will watch from the end, I will watch from the beginning and we'll meet in the middle and exchange information."
265,Watched by,I waited a year to see it and now I need another year to process it.
266,Watched by,"no sex scenes in reverse, Nolan is a coward"
267,★★★★,"my haters will say ""did u even understand what happened?!?!"" and i will just flip my hair and say ""who gives a fuck?"""
268,★★★★,HE LOOKED SO GOOD HERE THIS IS BY FAR HIS BEST LOOK EVER OMG IT WAS PERFECT I HAD TO REWIND SO MANY SCENES CAUSE I COULDNT PAY ATTENTION HE JUST LOOKED THAT GOOD AND UGH THE WHOKE LOOK IS PERFECT!! HIS HAIR COLOR IS GENUINELY SO NICE AJD IT COMPLIMENTS HIS SKIN SO WELL AND THE SUITS MMM SHOULDER PADS AND YEA I LOVE THEM!! ALSO HIM USING HIS (almost) ACTUAL ACCENT WAS SO GOOD I LOVE IT!! I COULD GO ON FOREVER ON WHY THIS IS HIS BEST LOOK SO FAR
269,★★★★,Andre 0
270,★★½,"there is literally no point in trying to make the central conceit ""make sense"" so might as well just wait for the supercuts of elizabeth debicki saying ""my son"". also would like to wish a very happy pride to robert pattinson's first gay character, whether he knows it or not."
271,★★★★½,(but I liked it a lot)
272,★★½,note: christopher nolan still cannot write good female characters.
273,★★★★,i love obama
274,★★,Christopher Nolan is bad at sex
275,★★★½,ghostwritten by shane carruth
276,★★★½,"Very interesting blockbuster, still love that soundtrack."
277,★★★★,They gave us free popcorn instead.
278,★★★½,"say what you want about christopher nolan, but the man knows how to open a movie"
279,★★★★,"Narrative and character development are not the strenghs of the film. In the scheme of things, these elements probably don't even matter as much as creating the action of the world of espionage and trickery of ""Tenet""."
280,★★★,"It took Nolan six years to write the screenplay, now I need six years to figure it out."
281,★★★★,"Finally watching Tenet for the 4th time (the first time in a home cinema and with my parents) and being able to explain the context of the film to my mum and dad, who seemed to have mutated into human question marks in these 150 minutes, in such a way that they are now human exclamation marks, is probably already the greatest intellectual achievement I will be capable of this year."
282,★★½,"Great cinematography, but confusing as hell"
283,★★★★★,my one dream in life is to go sail on a yacht with elizabeth debicki off the amalfi coast
284,Watched by,This review hasn't happened yet.
